65298773,65298773,Sesame Software Suite BYOL,Sesame Software,,Migration,Data Integration,Sesame Software's data management suite enables seamless data integration and replication with Oracle Cloud applications and a wide variety of data sources. BYOL gives you the flexibility to pick and choose the functionality and data source connectors needed to support your business needs.,,PARTNER,IMAGE,,,,,,,,,,,,,,,,,,,,,,,,X86,,,,UNKNOWN,False,False,UNKNOWN,,False,False,UNKNOWN,False,UNRESTRICTED,LOW,Other,LOW,LOW,False,True,True,False,,,,,https://cloudmarketplace.oracle.com/marketplace/en_US/listing/65298773,,Analysis based on content only - no government region access
65804594,65804594,Aviatrix Secure Networking Platform,Aviatrix,,Security,Networking,Aviatrix provides: 1) Secure Multi-Cloud Transit Network; 2) Multi-Cloud Automated Route Programming and Orchestration 3) Automated Firewall deployment; 4) Secure Use,,PARTNER,ORCHESTRATION,,,,,,,,,,,,,,,,,,,,,,,,,,,,UNKNOWN,False,False,UNKNOWN,,False,False,UNKNOWN,False,UNRESTRICTED,LOW,Security,UNKNOWN,LOW,True,False,False,True,,,,,https://cloudmarketplace.oracle.com/marketplace/en_US/listing/65804594,,Analysis based on content only - no government region access
65847636,65847636,Aviatrix Secure Networking Platform - BYOL,Aviatrix,,Security,Networking,Aviatrix provides: 1) Secure Multi-Cloud Transit Network; 2) Multi-Cloud Automated Route Programming and Orchestration 3) Automated Firewall deployment; 4) Secure User Access – SSL VPN with MFA and SAML clients for user access to cloud; 5) IPSec Site2Cloud VPN for branches and sites,,PARTNER,ORCHESTRATION,,,,,,,,,,,,,,,,,,,,,,,,,,,,UNKNOWN,False,False,UNKNOWN,,False,False,UNKNOWN,False,UNRESTRICTED,LOW,Security,UNKNOWN,LOW,True,True,False,True,,,,,https://cloudmarketplace.oracle.com/marketplace/en_US/listing/65847636,,Analysis based on content only - no government region access
66187311,66187311,FortiAuthenticator (BYOL),Fortinet,,Networking,Security,"FortiAuthenticator is a user and identity management solution that provides strong authentication, wireless 802.1X
authentication, certificate management, and Fortinet Single Sign-On (FSSO).",,PARTNER,IMAGE,,,,,,,,,,,,,,,,,,,,,,,,X86,,,,UNKNOWN,False,False,UNKNOWN,,False,False,UNKNOWN,False,UNRESTRICTED,HIGH,Networking,LOW,LOW,True,False,False,False,,,,,https://cloudmarketplace.oracle.com/marketplace/en_US/listing/66187311,,Analysis based on content only - no government region access
66489465,66489465,Oracle GoldenGate for Non-Oracle,Oracle,,Migration,Data Integration,"Oracle GoldenGate 23ai, 21c, and 19c for Non-Oracle Databases",,PARTNER,ORCHESTRATION,,,,,,,,,,,,,,,,,,,,,,,,,,,,UNKNOWN,False,False,UNKNOWN,,False,False,UNKNOWN,False,UNRESTRICTED,LOW,Other,UNKNOWN,LOW,False,True,True,False,,,,,https://cloudmarketplace.oracle.com/marketplace/en_US/listing/66489465,,Analysis based on content only - no government region access
66491199,66491199,GoldenGate for Distributed Applications and Analytics,Oracle,,Data Integration,Migration,Oracle GoldenGate for Distributed Applications and Analytics,,PARTNER,ORCHESTRATION,,,,,,,,,,,,,,,,,,,,,,,,,,,,UNKNOWN,False,False,UNKNOWN,,False,False,UNKNOWN,False,UNRESTRICTED,LOW,Analytics,UNKNOWN,LOW,False,False,True,False,,,,,https://cloudmarketplace.oracle.com/marketplace/en_US/listing/66491199,,Analysis based on content only - no government region access
67149438,67149438,PeopleSoft Cloud Manager for OCI,Oracle,,Cloud Management,,"PeopleSoft Cloud Manager provides easy to use platform administration capabilities, including provisioning automation and monitoring for PeopleSoft application environments.",,PARTNER,ORCHESTRATION,,,,,,,,,,,,,,,,,,,,,,,,,,,,UNKNOWN,False,False,UNKNOWN,,False,False,UNKNOWN,False,UNRESTRICTED,LOW,Other,UNKNOWN,LOW,False,False,False,False,,,,,https://cloudmarketplace.oracle.com/marketplace/en_US/listing/67149438,,Analysis based on content only - no government region access
67436312,67436312,MySQL Enterprise Edition,Oracle,,Other,Big Data,"MySQL Enterprise Edition on Oracle Cloud Infrastructure enables customers to get their MySQL database workloads to the cloud easily, securely, and reliably.",,PARTNER,IMAGE,,,,,,,,,,,,,,,,,,,,,,,,X86,,,,UNKNOWN,False,False,UNKNOWN,,False,False,UNKNOWN,False,UNRESTRICTED,LOW,Database,LOW,LOW,False,False,True,False,,,,,https://cloudmarketplace.oracle.com/marketplace/en_US/listing/67436312,,Analysis based on content only - no government region access
67628143,67628143,HPC and GPU Cluster,Oracle,,High Performance Computing,,Automated HPC and GPU cluster deployment.,,PARTNER,ORCHESTRATION,,,,,,,,,,,,,,,,,,,,,,,,,,,,UNKNOWN,False,False,UNKNOWN,,False,False,UNKNOWN,False,UNRESTRICTED,LOW,Other,UNKNOWN,LOW,False,False,False,False,,,,,https://cloudmarketplace.oracle.com/marketplace/en_US/listing/67628143,,Analysis based on content only - no government region access
67762747,67762747,Migration for Servers/VMs,"Rackware, Inc.",,Migration,,RackWare provides a complete Workload Mobility Platform that extends across physical and virtual environments.,,PARTNER,IMAGE,,,,,,,,,,,,,,,,,,,,,,,,X86,,,,UNKNOWN,False,False,UNKNOWN,,False,False,UNKNOWN,False,UNRESTRICTED,LOW,Other,LOW,LOW,False,False,False,False,,,,,https://cloudmarketplace.oracle.com/marketplace/en_US/listing/67762747,,Analysis based on content only - no government region access
67771674,67771674,Oracle RDF Graph Adapter for Apache Jena,Oracle,,Analytics,Database Management,"The RDF graph feature in Oracle Database provides native support for RDF, OWL and SPARQL W3C standards for representing and querying knowledge graphs and semantic data. This app enables users to create a SPARQL end point using open source Apache Jena / Fuseki, for querying RDF graphs in a Oracle Database Cloud Service.",,PARTNER,ORCHESTRATION,,,,,,,,,,,,,,,,,,,,,,,,,,,,UNKNOWN,False,False,UNKNOWN,,False,False,UNKNOWN,False,UNRESTRICTED,LOW,Analytics,UNKNOWN,LOW,False,False,True,False,,,,,https://cloudmarketplace.oracle.com/marketplace/en_US/listing/67771674,,Analysis based on content only - no government region access
67812026,67812026,Oracle Essbase - UCM,Oracle,,Business Applications,,Oracle Essbase,,PARTNER,ORCHESTRATION,,,,,,,,,,,,,,,,,,,,,,,,,,,,UNKNOWN,False,False,UNKNOWN,,False,False,UNKNOWN,False,UNRESTRICTED,LOW,Other,UNKNOWN,LOW,False,False,True,False,,,,,https://cloudmarketplace.oracle.com/marketplace/en_US/listing/67812026,,Analysis based on content only - no government region access
67830324,67830324,OpenVPN Access Server BYOL,OpenVPN Inc.,,Networking,Security,"Powerful web interface that lets you configure remote access to resources, granular access control, and simplifies installation and configuration of client devices. Automated PKI built-in infrastructure reduces complicated setup procedures. Clients for Windows, macOS, Linux, Android and iOS.",,PARTNER,IMAGE,,,,,,,,,,,,,,,,,,,,,,,,X86,,,,UNKNOWN,False,False,UNKNOWN,,False,False,UNKNOWN,False,UNRESTRICTED,LOW,Security,LOW,LOW,True,False,False,False,,,,,https://cloudmarketplace.oracle.com/marketplace/en_US/listing/67830324,,Analysis based on content only - no government region access
68172334,68172334,JD Edwards EnterpriseOne One-Click Provisioning Server,Oracle,,Business Applications,,JD Edwards EnterpriseOne is a comprehensive suite of integrated global business applications. This machine image provided by Oracle allows your organization to create an One-Click Provisioning Server for JD Edwards for Release 9.2 in Oracle Cloud Infrastructure.,,PARTNER,IMAGE,,,,,,,,,,,,,,,,,,,,,,,,X86,,,,UNKNOWN,False,False,UNKNOWN,,False,False,UNKNOWN,False,UNRESTRICTED,LOW,Other,LOW,LOW,False,False,True,False,,,,,https://cloudmarketplace.oracle.com/marketplace/en_US/listing/68172334,,Analysis based on content only - no government region access
69149848,69149848,Oracle Identity Governance,Oracle,,Security,,"Oracle Identity Management provides a unified, integrated security platform designed to manage user lifecycle and provide secure access across the enterprise resources, both within and beyond the firewall and into the cloud.",,PARTNER,ORCHESTRATION,,,,,,,,,,,,,,,,,,,,,,,,,,,,UNKNOWN,False,False,UNKNOWN,,False,False,UNKNOWN,False,UNRESTRICTED,LOW,Security,UNKNOWN,LOW,True,False,True,False,,,,,https://cloudmarketplace.oracle.com/marketplace/en_US/listing/69149848,,Analysis based on content only - no government region access
70276523,70276523,Oracle WebLogic Server Enterprise Edition UCM Image,Oracle,,Application Development,,The Oracle WebLogic Server for OCI image provides binaries of the Oracle WebLogic Server and the Java Development Toolkit along with the entitlement to create Oracle WebLogic Server domains in Oracle Cloud Infrastructure Compute Instances.,,PARTNER,IMAGE,,,,,,,,,,,,,,,,,,,,,,,,X86,,,,UNKNOWN,False,False,UNKNOWN,,False,False,UNKNOWN,False,UNRESTRICTED,LOW,Other,LOW,LOW,False,True,True,False,,,,,https://cloudmarketplace.oracle.com/marketplace/en_US/listing/70276523,,Analysis based on content only - no government region access
70277452,70277452,Oracle WebLogic Suite UCM Image,Oracle,,Application Development,,"Quickly create Oracle Cloud Infrastructure Compute instances that contain the key components needed to develop, test, and deploy Java EE applications in Oracle WebLogic Server or Oracle Forms applications in Oracle Cloud Infrastructure.",,PARTNER,IMAGE,,,,,,,,,,,,,,,,,,,,,,,,X86,,,,UNKNOWN,False,False,UNKNOWN,,False,False,UNKNOWN,False,UNRESTRICTED,LOW,Other,LOW,LOW,False,True,True,False,,,,,https://cloudmarketplace.oracle.com/marketplace/en_US/listing/70277452,,Analysis based on content only - no government region access
70472252,70472252,Oracle Enterprise Command Center Framework,Oracle,,Application Development,Packaged Application,Oracle Enterprise Command Center Framework for Oracle E-Business Suite,,PARTNER,IMAGE,,,,,,,,,,,,,,,,,,,,,,,,X86,,,,UNKNOWN,False,False,UNKNOWN,,False,False,UNKNOWN,False,UNRESTRICTED,LOW,Other,LOW,LOW,False,False,True,False,,,,,https://cloudmarketplace.oracle.com/marketplace/en_US/listing/70472252,,Analysis based on content only - no government region access
70961838,70961838,Oracle GoldenGate Stream Analytics,Oracle,,Data Integration,Big Data,Oracle GoldenGate Stream Analytics allows users to build scalable data transformation and analytics pipelines for agile real-time business insights.,,PARTNER,ORCHESTRATION,,,,,,,,,,,,,,,,,,,,,,,,,,,,UNKNOWN,False,False,UNKNOWN,,False,False,UNKNOWN,False,UNRESTRICTED,LOW,Analytics,UNKNOWN,LOW,False,False,True,False,,,,,https://cloudmarketplace.oracle.com/marketplace/en_US/listing/70961838,,Analysis based on content only - no government region access
71285857,71285857,Palo Alto Networks VM-Series Next Generation Firewall,Palo Alto Networks,,Networking,Security,The VM-Series next-generation firewall protects your applications and data with the same security capabilities that protects thousands of customer networks worldwide.,,PARTNER,IMAGE,,,,,,,,,,,,,,,,,,,,,,,,X86,,,,UNKNOWN,False,False,UNKNOWN,,False,False,UNKNOWN,False,UNRESTRICTED,HIGH,Security,LOW,LOW,True,False,False,True,,,,,https://cloudmarketplace.oracle.com/marketplace/en_US/listing/71285857,,Analysis based on content only - no government region access
71472162,71472162,Oracle Spatial Studio,Oracle,,Packaged Application,,Oracle Spatial Studio is a self-service web application that makes it easy for users to create interactive maps and perform spatial analysis on their business data.,,PARTNER,ORCHESTRATION,,,,,,,,,,,,,,,,,,,,,,,,,,,,UNKNOWN,False,False,UNKNOWN,,False,False,UNKNOWN,False,UNRESTRICTED,LOW,Other,UNKNOWN,LOW,False,False,True,False,,,,,https://cloudmarketplace.oracle.com/marketplace/en_US/listing/71472162,,Analysis based on content only - no government region access
72492657,72492657,Oracle WebLogic Suite UCM,Oracle,,Application Development,,Quickly provision an Oracle WebLogic Server domain in Oracle Cloud Infrastructure for developing and deploying Java Enterprise Edition (Java EE) applications.,,PARTNER,ORCHESTRATION,,,,,,,,,,,,,,,,,,,,,,,,,,,,UNKNOWN,False,False,UNKNOWN,,False,False,UNKNOWN,False,UNRESTRICTED,LOW,Other,UNKNOWN,LOW,False,True,True,False,,,,,https://cloudmarketplace.oracle.com/marketplace/en_US/listing/72492657,,Analysis based on content only - no government region access
72493372,72493372,Oracle WebLogic Server Enterprise Edition UCM,Oracle,,Application Development,,Quickly provision an Oracle WebLogic Server domain in Oracle Cloud Infrastructure for developing and deploying Java Enterprise Edition (Java EE) applications.,,PARTNER,ORCHESTRATION,,,,,,,,,,,,,,,,,,,,,,,,,,,,UNKNOWN,False,False,UNKNOWN,,False,False,UNKNOWN,False,UNRESTRICTED,LOW,Other,UNKNOWN,LOW,False,True,True,False,,,,,https://cloudmarketplace.oracle.com/marketplace/en_US/listing/72493372,,Analysis based on content only - no government region access
72858089,72858089,UiPath Robot + Studio,UiPath,,Data Integration,,Deploy a UiPath Robot to one or multiple instances and connect to an existing Orchestrator.,,PARTNER,ORCHESTRATION,,,,,,,,,,,,,,,,,,,,,,,,,,,,UNKNOWN,False,False,UNKNOWN,,False,False,UNKNOWN,False,UNRESTRICTED,LOW,Other,UNKNOWN,LOW,False,False,False,False,,,,,https://cloudmarketplace.oracle.com/marketplace/en_US/listing/72858089,,Analysis based on content only - no government region access
73007917,73007917,Oracle SOA Suite Compute Image (BYOL),Oracle,,Data Integration,Application Development,SOA Suite Compute Image  on Marketplace using Oracle Cloud Infrastructure,,PARTNER,IMAGE,,,,,,,,,,,,,,,,,,,,,,,,X86,,,,UNKNOWN,False,False,UNKNOWN,,False,False,UNKNOWN,False,UNRESTRICTED,LOW,Other,LOW,LOW,False,False,True,False,,,,,https://cloudmarketplace.oracle.com/marketplace/en_US/listing/73007917,,Analysis based on content only - no government region access
73023780,73023780,"Cristie Virtual Appliance for Recovery Assurance, Machine Mobility and Backup",Cristie Software Ltd,,Migration,Backup and Recovery,"The Cristie Virtual Appliance provides instant system bare metal recovery, machine mobility, replication and DR orchestration. The Cristie VA is a flexible solution solving a multitude of problems. Over 100 of the Global Fortune 500 Companies use Cristie products for data protection and disaster recovery.",,PARTNER,IMAGE,,,,,,,,,,,,,,,,,,,,,,,,X86,,,,UNKNOWN,False,False,UNKNOWN,,False,False,UNKNOWN,False,UNRESTRICTED,LOW,Analytics,LOW,LOW,False,False,False,False,,,,,https://cloudmarketplace.oracle.com/marketplace/en_US/listing/73023780,,Analysis based on content only - no government region access
73275127,73275127,FoldingATHome GPU Image,Oracle,,High Performance Computing,,Folding@Home image can be deployed as-is on BM.GPU2.2 shapes for protein folding workloads,,PARTNER,IMAGE,,,,,,,,,,,,,,,,,,,,,,,,X86,,,,UNKNOWN,False,False,UNKNOWN,,False,False,UNKNOWN,False,UNRESTRICTED,LOW,Other,LOW,LOW,False,False,False,False,,,,,https://cloudmarketplace.oracle.com/marketplace/en_US/listing/73275127,,Analysis based on content only - no government region access
73328167,73328167,Lustre Filesystem,Oracle,,High Performance Computing,Storage,"Lustre software is a scalable, parallel open source file system",,PARTNER,ORCHESTRATION,,,,,,,,,,,,,,,,,,,,,,,,,,,,UNKNOWN,False,False,UNKNOWN,,False,False,UNKNOWN,False,UNRESTRICTED,LOW,Other,UNKNOWN,LOW,False,False,False,False,,,,,https://cloudmarketplace.oracle.com/marketplace/en_US/listing/73328167,,Analysis based on content only - no government region access
73333754,73333754,Gluster Filesystem,Oracle,,Storage,High Performance Computing,GlusterFS is a scalable network filesystem,,PARTNER,ORCHESTRATION,,,,,,,,,,,,,,,,,,,,,,,,,,,,UNKNOWN,False,False,UNKNOWN,,False,False,UNKNOWN,False,UNRESTRICTED,LOW,Other,UNKNOWN,LOW,False,False,False,True,,,,,https://cloudmarketplace.oracle.com/marketplace/en_US/listing/73333754,,Analysis based on content only - no government region access
73384108,73384108,Oracle Access Management,Oracle,,Security,,"Oracle Access Management provides an enterprise-level security platform, delivers risk-aware end-to-end user authentication, single sign-on, and authorization protection.",,PARTNER,ORCHESTRATION,,,,,,,,,,,,,,,,,,,,,,,,,,,,UNKNOWN,False,False,UNKNOWN,,False,False,UNKNOWN,False,UNRESTRICTED,LOW,Security,UNKNOWN,LOW,True,False,True,False,,,,,https://cloudmarketplace.oracle.com/marketplace/en_US/listing/73384108,,Analysis based on content only - no government region access
73384189,73384189,Oracle Unified Directory,Oracle,,Security,,Oracle Unified Directory provides comprehensive Directory Solution for robust Identity Management.,,PARTNER,ORCHESTRATION,,,,,,,,,,,,,,,,,,,,,,,,,,,,UNKNOWN,False,False,UNKNOWN,,False,False,UNKNOWN,False,UNRESTRICTED,LOW,Security,UNKNOWN,LOW,False,False,True,False,,,,,https://cloudmarketplace.oracle.com/marketplace/en_US/listing/73384189,,Analysis based on content only - no government region access
73388855,73388855,Varnish Enterprise 6 for Oracle Cloud Infrastructure OCI,Varnish Software Inc,,Networking,,"A supercharged version of Varnish Cache, for accelerating content delivery while protecting web services",,PARTNER,IMAGE,,,,,,,,,,,,,,,,,,,,,,,,X86,,,,UNKNOWN,False,False,UNKNOWN,,False,False,UNKNOWN,False,UNRESTRICTED,LOW,Networking,LOW,LOW,False,False,True,False,,,,,https://cloudmarketplace.oracle.com/marketplace/en_US/listing/73388855,,Analysis based on content only - no government region access
73473479,73473479,RFgen v5.1,"RFgen Software, A division of the DataMAX Software Group",,SaaS on Oracle Cloud Platform,Data Integration,Library of 50+ mobile-first supply chain apps - fully integrated with Oracle SCM Cloud for immediate benefits to your supply chain processes.,,PARTNER,IMAGE,,,,,,,,,,,,,,,,,,,,,,,,X86,,,,UNKNOWN,False,False,UNKNOWN,,False,False,UNKNOWN,False,UNRESTRICTED,LOW,Other,LOW,LOW,False,True,True,False,,,,,https://cloudmarketplace.oracle.com/marketplace/en_US/listing/73473479,,Analysis based on content only - no government region access
73475878,73475878,Vendita MAS v4.0,Vendita Technology Group Inc,,SaaS on Oracle Cloud Platform,Packaged Application,"Vendita MAS - DBA Tools, Database Automation, Oracle License Management",,PARTNER,IMAGE,,,,,,,,,,,,,,,,,,,,,,,,X86,,,,UNKNOWN,False,False,UNKNOWN,,False,False,UNKNOWN,False,UNRESTRICTED,LOW,Other,LOW,LOW,False,False,True,False,,,,,https://cloudmarketplace.oracle.com/marketplace/en_US/listing/73475878,,Analysis based on content only - no government region access
74028359,74028359,Visual Studio Code Remote Workstation,Oracle,,Developer Tools,,Visual Studio Code Remote Workstation on Oracle Cloud Infrastructure,,PARTNER,IMAGE,,,,,,,,,,,,,,,,,,,,,,,,X86,,,,UNKNOWN,False,False,UNKNOWN,,False,False,UNKNOWN,False,UNRESTRICTED,LOW,Other,LOW,LOW,False,False,True,False,,,,,https://cloudmarketplace.oracle.com/marketplace/en_US/listing/74028359,,Analysis based on content only - no government region access
74084544,74084544,AI 'all-in-one' Data Science Image for GPU,Oracle,,High Performance Computing,,Oracle Linux 8.x GPU Image with preconfigured AI/ML/DL packages and libraries with Oracle AutoML (updated September 2022),,PARTNER,IMAGE,,,,,,,,,,,,,,,,,,,,,,,,X86,,,,UNKNOWN,False,False,UNKNOWN,,False,False,UNKNOWN,False,UNRESTRICTED,LOW,AI/ML,LOW,LOW,False,True,True,False,,,,,https://cloudmarketplace.oracle.com/marketplace/en_US/listing/74084544,,Analysis based on content only - no government region access
74515630,74515630,CloudGuard Security Management for up to 5 Gateways,Check Point Software Technologies Ltd.,,Security,Networking,"A single pane-of-glass security management console delivers consistent visibility, policy management, logging, reporting and control across all cloud environments and networks",,PARTNER,IMAGE,,,,,,,,,,,,,,,,,,,,,,,,X86,,,,UNKNOWN,False,False,UNKNOWN,,False,False,UNKNOWN,False,UNRESTRICTED,LOW,Security,LOW,LOW,True,False,False,True,,,,,https://cloudmarketplace.oracle.com/marketplace/en_US/listing/74515630,,Analysis based on content only - no government region access
74517285,74517285,CloudGuard Security Management for up to 25 Gateways,Check Point Software Technologies Ltd.,,Networking,Security,"A single pane-of-glass security management console delivers consistent visibility, policy management, logging, reporting and control across all cloud environments and networks",,PARTNER,IMAGE,,,,,,,,,,,,,,,,,,,,,,,,X86,,,,UNKNOWN,False,False,UNKNOWN,,False,False,UNKNOWN,False,UNRESTRICTED,LOW,Security,LOW,LOW,True,False,False,True,,,,,https://cloudmarketplace.oracle.com/marketplace/en_US/listing/74517285,,Analysis based on content only - no government region access
74518826,74518826,CloudGuard Next-Gen Firewall w/ Threat Prevention - 1 OCPU,Check Point Software Technologies Ltd.,,Security,Networking,Advanced threat prevention and security for OCI and hybrid cloud environments,,PARTNER,IMAGE,,,,,,,,,,,,,,,,,,,,,,,,X86,,,,UNKNOWN,False,False,UNKNOWN,,False,False,UNKNOWN,False,UNRESTRICTED,LOW,Security,LOW,LOW,True,False,False,False,,,,,https://cloudmarketplace.oracle.com/marketplace/en_US/listing/74518826,,Analysis based on content only - no government region access
74519457,74519457,CloudGuard Next-Gen Firewall w/ Threat Prevention and SandBlast - 1 OCPU,Check Point Software Technologies Ltd.,,Networking,Security,"Advanced threat prevention and security for OCI and hybrid cloud environments, with SandBlast Zero-Day Protection",,PARTNER,IMAGE,,,,,,,,,,,,,,,,,,,,,,,,X86,,,,UNKNOWN,False,False,UNKNOWN,,False,False,UNKNOWN,False,UNRESTRICTED,LOW,Security,LOW,LOW,True,False,False,False,,,,,https://cloudmarketplace.oracle.com/marketplace/en_US/listing/74519457,,Analysis based on content only - no government region access
74520160,74520160,CloudGuard Next-Gen Firewall w/ Threat Prevention - 2 OCPUs,Check Point Software Technologies Ltd.,,Networking,Security,Advanced threat prevention and security for OCI and hybrid cloud environments,,PARTNER,IMAGE,,,,,,,,,,,,,,,,,,,,,,,,X86,,,,UNKNOWN,False,False,UNKNOWN,,False,False,UNKNOWN,False,UNRESTRICTED,LOW,Security,LOW,LOW,True,False,False,False,,,,,https://cloudmarketplace.oracle.com/marketplace/en_US/listing/74520160,,Analysis based on content only - no government region access
74520447,74520447,CloudGuard Next-Gen Firewall w/ Threat Prevention and SandBlast - 2 OCPUs,Check Point Software Technologies Ltd.,,Security,Networking,"Advanced threat prevention and security for OCI and hybrid cloud environments, with SandBlast Zero-Day Protection",,PARTNER,IMAGE,,,,,,,,,,,,,,,,,,,,,,,,X86,,,,UNKNOWN,False,False,UNKNOWN,,False,False,UNKNOWN,False,UNRESTRICTED,LOW,Security,LOW,LOW,True,False,False,False,,,,,https://cloudmarketplace.oracle.com/marketplace/en_US/listing/74520447,,Analysis based on content only - no government region access
74520657,74520657,CloudGuard Next-Gen Firewall w/ Threat Prevention - 4 OCPUs,Check Point Software Technologies Ltd.,,Networking,Security,Advanced threat prevention and security for OCI and hybrid cloud environments,,PARTNER,IMAGE,,,,,,,,,,,,,,,,,,,,,,,,X86,,,,UNKNOWN,False,False,UNKNOWN,,False,False,UNKNOWN,False,UNRESTRICTED,LOW,Security,LOW,LOW,True,False,False,False,,,,,https://cloudmarketplace.oracle.com/marketplace/en_US/listing/74520657,,Analysis based on content only - no government region access
74521000,74521000,CloudGuard Next-Gen Firewall w/ Threat Prevention and SandBlast - 4 OCPUs,Check Point Software Technologies Ltd.,,Security,Networking,"Advanced threat prevention and security for OCI and hybrid cloud environments, with SandBlast Zero-Day Protection",,PARTNER,IMAGE,,,,,,,,,,,,,,,,,,,,,,,,X86,,,,UNKNOWN,False,False,UNKNOWN,,False,False,UNKNOWN,False,UNRESTRICTED,LOW,Security,LOW,LOW,True,False,False,False,,,,,https://cloudmarketplace.oracle.com/marketplace/en_US/listing/74521000,,Analysis based on content only - no government region access
74521546,74521546,CloudGuard Next-Gen Firewall w/ Threat Prevention - 8 OCPUs,Check Point Software Technologies Ltd.,,Security,Networking,Advanced threat prevention and security for OCI and hybrid cloud environments,,PARTNER,IMAGE,,,,,,,,,,,,,,,,,,,,,,,,X86,,,,UNKNOWN,False,False,UNKNOWN,,False,False,UNKNOWN,False,UNRESTRICTED,LOW,Security,LOW,LOW,True,False,False,False,,,,,https://cloudmarketplace.oracle.com/marketplace/en_US/listing/74521546,,Analysis based on content only - no government region access
74521723,74521723,CloudGuard Next-Gen Firewall w/ Threat Prevention and SandBlast - 8 OCPUs,Check Point Software Technologies Ltd.,,Networking,Security,"Advanced threat prevention and security for OCI and hybrid cloud environments, with SandBlast Zero-Day Protection",,PARTNER,IMAGE,,,,,,,,,,,,,,,,,,,,,,,,X86,,,,UNKNOWN,False,False,UNKNOWN,,False,False,UNKNOWN,False,UNRESTRICTED,LOW,Security,LOW,LOW,True,False,False,False,,,,,https://cloudmarketplace.oracle.com/marketplace/en_US/listing/74521723,,Analysis based on content only - no government region access
74654105,74654105,Oracle Database Sharding,Oracle,,Database,,"Oracle Sharding enables globally distributed, linearly scalable, converged databases. It supports applications that require low response time and high availability, and meets data sovereignty requirements.",,PARTNER,ORCHESTRATION,,,,,,,,,,,,,,,,,,,,,,,,,,,,UNKNOWN,False,False,UNKNOWN,,False,False,UNKNOWN,False,RESTRICTED,LOW,Database,UNKNOWN,LOW,False,True,True,False,,,,,https://cloudmarketplace.oracle.com/marketplace/en_US/listing/74654105,,Analysis based on content only - no government region access
74792101,74792101,Oracle SOA Suite (BYOL),Oracle,,Application Development,,Quickly provision Oracle SOA Suite on Marketplace using Oracle Cloud Infrastructure,,PARTNER,ORCHESTRATION,,,,,,,,,,,,,,,,,,,,,,,,,,,,UNKNOWN,False,False,UNKNOWN,,False,False,UNKNOWN,False,UNRESTRICTED,LOW,Other,UNKNOWN,LOW,False,False,True,False,,,,,https://cloudmarketplace.oracle.com/marketplace/en_US/listing/74792101,,Analysis based on content only - no government region access
