172262701,172262701,Abantecart eCommerce Platform on Ubuntu 20.04 lts focal,Cognosys Inc.,,Data Integration,Application Development,"Deploy Abantecart eCommerce Platform on Ubuntu 20.04 lts focal at Oracle cloud to enhance web performance with caching strategies, speed up content delivery, and reduce server load.",,PARTNER,IMAGE,,,,,,,,,,,,,,,,,,,,,,,,X86,,,,UNKNOWN,False,False,UNKNOWN,,False,False,UNKNOWN,False,UNRESTRICTED,LOW,Other,LOW,LOW,False,False,True,False,,,,,https://cloudmarketplace.oracle.com/marketplace/en_US/listing/172262701,,Analysis based on content only - no government region access
172262731,172262731,Abantecart eCommerce Platform on Ubuntu 22.04 lts,Cognosys Inc.,,Data Integration,Application Development,"Deploy Abantecart eCommerce Platform on Ubuntu 22.04 lts at Oracle cloud to enhance web performance with caching strategies, speed up content delivery, and reduce server load.",,PARTNER,IMAGE,,,,,,,,,,,,,,,,,,,,,,,,X86,,,,UNKNOWN,False,False,UNKNOWN,,False,False,UNKNOWN,False,UNRESTRICTED,LOW,Other,LOW,LOW,False,False,True,False,,,,,https://cloudmarketplace.oracle.com/marketplace/en_US/listing/172262731,,Analysis based on content only - no government region access
172262769,172262769,Clamav Antivirus on Centos 7,Cognosys Inc.,,Data Integration,Application Development,"Deploy Clamav Antivirus on Centos 7 at Oracle cloud to improve web performance, content delivery speed, and reduce server load.",,PARTNER,IMAGE,,,,,,,,,,,,,,,,,,,,,,,,X86,,,,UNKNOWN,False,False,UNKNOWN,,False,False,UNKNOWN,False,UNRESTRICTED,LOW,Other,LOW,LOW,False,False,True,False,,,,,https://cloudmarketplace.oracle.com/marketplace/en_US/listing/172262769,,Analysis based on content only - no government region access
172262788,172262788,Clamav Antivirus on Centos 8,Cognosys Inc.,,Database,Data Integration,"Deploy Clamav Antivirus on Centos 8 at Oracle cloud to improve web performance, content delivery speed, and reduce server load.",,PARTNER,IMAGE,,,,,,,,,,,,,,,,,,,,,,,,X86,,,,UNKNOWN,False,False,UNKNOWN,,False,False,UNKNOWN,False,UNRESTRICTED,LOW,Database,LOW,LOW,False,False,True,False,,,,,https://cloudmarketplace.oracle.com/marketplace/en_US/listing/172262788,,Analysis based on content only - no government region access
172262807,172262807,Clamav Antivirus on Oracle enterprise linux,Cognosys Inc.,,Data Integration,Application Development,"Deploy Clamav Antivirus on Oracle enterprise linux at Oracle cloud to improve web performance, content delivery speed, and reduce server load.",,PARTNER,IMAGE,,,,,,,,,,,,,,,,,,,,,,,,X86,,,,UNKNOWN,False,False,UNKNOWN,,False,False,UNKNOWN,False,UNRESTRICTED,LOW,Other,LOW,LOW,False,False,True,False,,,,,https://cloudmarketplace.oracle.com/marketplace/en_US/listing/172262807,,Analysis based on content only - no government region access
172262846,172262846,Clamav Antivirus on Ubuntu 20.04 lts focal,Cognosys Inc.,,Data Integration,Application Development,"Deploy Clamav Antivirus on Ubuntu 20.04 lts focal at Oracle cloud to improve web performance, content delivery speed, and reduce server load.",,PARTNER,IMAGE,,,,,,,,,,,,,,,,,,,,,,,,X86,,,,UNKNOWN,False,False,UNKNOWN,,False,False,UNKNOWN,False,UNRESTRICTED,LOW,Other,LOW,LOW,False,False,True,False,,,,,https://cloudmarketplace.oracle.com/marketplace/en_US/listing/172262846,,Analysis based on content only - no government region access
172262867,172262867,Clamav Antivirus on Ubuntu 22.04 lts,Cognosys Inc.,,Data Integration,Application Development,"Deploy Clamav Antivirus on Ubuntu 22.04 lts at Oracle cloud to improve web performance, content delivery speed, and reduce server load.",,PARTNER,IMAGE,,,,,,,,,,,,,,,,,,,,,,,,X86,,,,UNKNOWN,False,False,UNKNOWN,,False,False,UNKNOWN,False,UNRESTRICTED,LOW,Other,LOW,LOW,False,False,True,False,,,,,https://cloudmarketplace.oracle.com/marketplace/en_US/listing/172262867,,Analysis based on content only - no government region access
172262905,172262905,Docker on Centos 7,Cognosys Inc.,,Data Integration,Application Development,"Deploy Docker on Centos 7 at Oracle to boost web performance, improve content delivery, and optimize server load.",,PARTNER,IMAGE,,,,,,,,,,,,,,,,,,,,,,,,X86,,,,UNKNOWN,False,False,UNKNOWN,,False,False,UNKNOWN,False,UNRESTRICTED,LOW,Other,LOW,LOW,False,False,True,False,,,,,https://cloudmarketplace.oracle.com/marketplace/en_US/listing/172262905,,Analysis based on content only - no government region access
172262948,172262948,Docker on Oracle enterprise linux,Cognosys Inc.,,Data Integration,Application Development,"Deploy Docker on Oracle enterprise linux at Oracle to boost web performance, improve content delivery, and optimize server load.",,PARTNER,IMAGE,,,,,,,,,,,,,,,,,,,,,,,,X86,,,,UNKNOWN,False,False,UNKNOWN,,False,False,UNKNOWN,False,UNRESTRICTED,LOW,Other,LOW,LOW,False,False,True,False,,,,,https://cloudmarketplace.oracle.com/marketplace/en_US/listing/172262948,,Analysis based on content only - no government region access
172262987,172262987,Docker on Ubuntu 20.04 lts focal,Cognosys Inc.,,Data Integration,Application Development,"Deploy Docker on Ubuntu 20.04 lts focal at Oracle to boost web performance, improve content delivery, and optimize server load.",,PARTNER,IMAGE,,,,,,,,,,,,,,,,,,,,,,,,X86,,,,UNKNOWN,False,False,UNKNOWN,,False,False,UNKNOWN,False,UNRESTRICTED,LOW,Other,LOW,LOW,False,False,True,False,,,,,https://cloudmarketplace.oracle.com/marketplace/en_US/listing/172262987,,Analysis based on content only - no government region access
172263007,172263007,Docker on Ubuntu 22.04 lts,Cognosys Inc.,,Data Integration,Application Development,"Deploy Docker on Ubuntu 22.04 lts at Oracle to boost web performance, improve content delivery, and optimize server load.",,PARTNER,IMAGE,,,,,,,,,,,,,,,,,,,,,,,,X86,,,,UNKNOWN,False,False,UNKNOWN,,False,False,UNKNOWN,False,UNRESTRICTED,LOW,Other,LOW,LOW,False,False,True,False,,,,,https://cloudmarketplace.oracle.com/marketplace/en_US/listing/172263007,,Analysis based on content only - no government region access
172263045,172263045,Drupal on Centos 7,Cognosys Inc.,,Data Integration,Application Development,"Deploy Drupal on Centos 7 at Oracle cloud to boost web performance, optimize content delivery, and reduce server load.",,PARTNER,IMAGE,,,,,,,,,,,,,,,,,,,,,,,,X86,,,,UNKNOWN,False,False,UNKNOWN,,False,False,UNKNOWN,False,UNRESTRICTED,LOW,Other,LOW,LOW,False,False,True,False,,,,,https://cloudmarketplace.oracle.com/marketplace/en_US/listing/172263045,,Analysis based on content only - no government region access
172263064,172263064,Drupal on Centos 8,Cognosys Inc.,,Data Integration,Application Development,"Deploy Drupal on Centos 8 at Oracle cloud to boost web performance, optimize content delivery, and reduce server load.",,PARTNER,IMAGE,,,,,,,,,,,,,,,,,,,,,,,,X86,,,,UNKNOWN,False,False,UNKNOWN,,False,False,UNKNOWN,False,UNRESTRICTED,LOW,Other,LOW,LOW,False,False,True,False,,,,,https://cloudmarketplace.oracle.com/marketplace/en_US/listing/172263064,,Analysis based on content only - no government region access
172263083,172263083,Drupal on Oracle enterprise linux,Cognosys Inc.,,Data Integration,Application Development,"Deploy Drupal on Oracle enterprise linux at Oracle cloud to boost web performance, optimize content delivery, and reduce server load.",,PARTNER,IMAGE,,,,,,,,,,,,,,,,,,,,,,,,X86,,,,UNKNOWN,False,False,UNKNOWN,,False,False,UNKNOWN,False,UNRESTRICTED,LOW,Other,LOW,LOW,False,False,True,False,,,,,https://cloudmarketplace.oracle.com/marketplace/en_US/listing/172263083,,Analysis based on content only - no government region access
172263126,172263126,Drupal on Ubuntu 20.04 lts focal,Cognosys Inc.,,Database,Data Integration,"Deploy Drupal on Ubuntu 20.04 lts focal at Oracle cloud to boost web performance, optimize content delivery, and reduce server load.",,PARTNER,IMAGE,,,,,,,,,,,,,,,,,,,,,,,,X86,,,,UNKNOWN,False,False,UNKNOWN,,False,False,UNKNOWN,False,UNRESTRICTED,LOW,Database,LOW,LOW,False,False,True,False,,,,,https://cloudmarketplace.oracle.com/marketplace/en_US/listing/172263126,,Analysis based on content only - no government region access
172263207,172263207,Sql Server 2022 Enterprise on Ubuntu 22.04 LTS,Cognosys Inc.,,Application Development,Database,"Experience the power of SQL Server 2022 Enterprise on Ubuntu 22.04 LTS. Deploy on Oracle for top-tier performance, security, and reliability.",,PARTNER,IMAGE,,,,,,,,,,,,,,,,,,,,,,,,X86,,,,UNKNOWN,False,False,UNKNOWN,,False,False,UNKNOWN,False,UNRESTRICTED,LOW,Database,LOW,LOW,True,False,True,False,,,,,https://cloudmarketplace.oracle.com/marketplace/en_US/listing/172263207,,Analysis based on content only - no government region access
172263312,172263312,Grafana on Oracle enterprise linux,Cognosys Inc.,,Data Integration,Application Development,"Deploy Grafana on Oracle enterprise linux at Oracle cloud to enhance web performance with caching strategies, speed up content delivery, and reduce server load.",,PARTNER,IMAGE,,,,,,,,,,,,,,,,,,,,,,,,X86,,,,UNKNOWN,False,False,UNKNOWN,,False,False,UNKNOWN,False,UNRESTRICTED,LOW,Other,LOW,LOW,False,False,True,False,,,,,https://cloudmarketplace.oracle.com/marketplace/en_US/listing/172263312,,Analysis based on content only - no government region access
172263494,172263494,Jenkins on Oracle enterprise linux,Cognosys Inc.,,Data Integration,Application Development,"Deploy Jenkins on Oracle enterprise linux at Oracle cloud to enhance web performance with caching strategies, speed up content delivery, and reduce server load.",,PARTNER,IMAGE,,,,,,,,,,,,,,,,,,,,,,,,X86,,,,UNKNOWN,False,False,UNKNOWN,,False,False,UNKNOWN,False,UNRESTRICTED,LOW,Other,LOW,LOW,False,False,True,False,,,,,https://cloudmarketplace.oracle.com/marketplace/en_US/listing/172263494,,Analysis based on content only - no government region access
172263824,172263824,LAMP Stack on Oracle enterprise linux,Cognosys Inc.,,Data Integration,Application Development,"Deploy LAMP Stack on Oracle enterprise linux at Oracle cloud to optimize web performance, streamline content delivery, and reduce server load.<br><br>With customizable caching rules, increase web traffic handling and accelerate content delivery for an enhanced user experience.",,PARTNER,IMAGE,,,,,,,,,,,,,,,,,,,,,,,,X86,,,,UNKNOWN,False,False,UNKNOWN,,False,False,UNKNOWN,False,UNRESTRICTED,LOW,Other,LOW,LOW,False,True,True,False,,,,,https://cloudmarketplace.oracle.com/marketplace/en_US/listing/172263824,,Analysis based on content only - no government region access
172263954,172263954,LEMP Stack-Ngnix MySql PHP on Oracle enterprise linux,Cognosys Inc.,,Data Integration,Application Development,"Deploy LEMP Stack - Ngnix MySql PHP on Oracle enterprise linux at Oracle cloud to enhance web performance with caching strategies, speed up content delivery, and reduce server load.",,PARTNER,IMAGE,,,,,,,,,,,,,,,,,,,,,,,,X86,,,,UNKNOWN,False,False,UNKNOWN,,False,False,UNKNOWN,False,UNRESTRICTED,LOW,Database,LOW,LOW,False,False,True,False,,,,,https://cloudmarketplace.oracle.com/marketplace/en_US/listing/172263954,,Analysis based on content only - no government region access
172264108,172264108,Limesurvey on Oracle enterprise linux,Cognosys Inc.,,Data Integration,Application Development,"Deploy Limesurvey on Oracle enterprise linux at Oracle cloud to enhance web performance with caching strategies, speed up content delivery, and reduce server load.",,PARTNER,IMAGE,,,,,,,,,,,,,,,,,,,,,,,,X86,,,,UNKNOWN,False,False,UNKNOWN,,False,False,UNKNOWN,False,UNRESTRICTED,LOW,Other,LOW,LOW,False,False,True,False,,,,,https://cloudmarketplace.oracle.com/marketplace/en_US/listing/172264108,,Analysis based on content only - no government region access
172264504,172264504,MySql 7 on Oracle enterprise linux,Cognosys Inc.,,Data Integration,Application Development,"Deploy MySql 7 on Oracle enterprise linux at Oracle cloud to enhance web performance with caching strategies, speed up content delivery, and reduce server load.",,PARTNER,IMAGE,,,,,,,,,,,,,,,,,,,,,,,,X86,,,,UNKNOWN,False,False,UNKNOWN,,False,False,UNKNOWN,False,UNRESTRICTED,LOW,Database,LOW,LOW,False,False,True,False,,,,,https://cloudmarketplace.oracle.com/marketplace/en_US/listing/172264504,,Analysis based on content only - no government region access
172264650,172264650,MySql 8 on Oracle enterprise linux,Cognosys Inc.,,Data Integration,Application Development,"Deploy MySql 8 on Oracle enterprise linux at Oracle cloud to enhance web performance with caching strategies, speed up content delivery, and reduce server load.",,PARTNER,IMAGE,,,,,,,,,,,,,,,,,,,,,,,,X86,,,,UNKNOWN,False,False,UNKNOWN,,False,False,UNKNOWN,False,UNRESTRICTED,LOW,Database,LOW,LOW,False,False,True,False,,,,,https://cloudmarketplace.oracle.com/marketplace/en_US/listing/172264650,,Analysis based on content only - no government region access
172264790,172264790,python on Oracle enterprise linux,Cognosys Inc.,,Data Integration,Application Development,"Deploy python on Oracle enterprise linux at Oracle cloud to boost web performance, optimize content delivery, and reduce server strain.",,PARTNER,IMAGE,,,,,,,,,,,,,,,,,,,,,,,,X86,,,,UNKNOWN,False,False,UNKNOWN,,False,False,UNKNOWN,False,UNRESTRICTED,LOW,Other,LOW,LOW,False,True,True,False,,,,,https://cloudmarketplace.oracle.com/marketplace/en_US/listing/172264790,,Analysis based on content only - no government region access
172264930,172264930,Optimized Redis on Oracle enterprise linux,Cognosys Inc.,,Data Integration,Application Development,"Deploy Redis on Oracle enterprise linux on Oracle cloud to boost web performance, enhance content delivery, and reduce server load.<br><br>Redis Cache accelerates web applications by efficiently caching content.",,PARTNER,IMAGE,,,,,,,,,,,,,,,,,,,,,,,,X86,,,,UNKNOWN,False,False,UNKNOWN,,False,False,UNKNOWN,False,UNRESTRICTED,LOW,Other,LOW,LOW,False,False,True,False,,,,,https://cloudmarketplace.oracle.com/marketplace/en_US/listing/172264930,,Analysis based on content only - no government region access
172265115,172265115,WordPress on Oracle enterprise linux,Cognosys Inc.,,Database,Data Integration,"Deploy WordPress on Oracle enterprise linux at Oracle to enhance web performance with caching strategies, speed up content delivery, and reduce server load.",,PARTNER,IMAGE,,,,,,,,,,,,,,,,,,,,,,,,X86,,,,UNKNOWN,False,False,UNKNOWN,,False,False,UNKNOWN,False,UNRESTRICTED,LOW,Database,LOW,LOW,False,False,True,False,,,,,https://cloudmarketplace.oracle.com/marketplace/en_US/listing/172265115,,Analysis based on content only - no government region access
172265311,172265311,Youtrack on Oracle enterprise linux,Cognosys Inc.,,Data Integration,Application Development,"Deploy Youtrack on Oracle enterprise linux at Oracle cloud to enhance web performance with caching strategies, speed up content delivery, and reduce server load.",,PARTNER,IMAGE,,,,,,,,,,,,,,,,,,,,,,,,X86,,,,UNKNOWN,False,False,UNKNOWN,,False,False,UNKNOWN,False,UNRESTRICTED,LOW,Other,LOW,LOW,False,False,True,False,,,,,https://cloudmarketplace.oracle.com/marketplace/en_US/listing/172265311,,Analysis based on content only - no government region access
172343814,172343814,OCI Observability with Grafana,Oracle,,Cloud Management,,"This OCI Resource Manager Stack simplifies cloud monitoring by deploying a pre-configured Grafana instance on OCI. It automates setup of compute resources, security policies, and OCI metric integration, allowing you to quickly visualise and analyse your cloud infrastructure data with example dashboards.",,PARTNER,ORCHESTRATION,,,,,,,,,,,,,,,,,,,,,,,,,,,,UNKNOWN,False,False,UNKNOWN,,False,False,UNKNOWN,False,UNRESTRICTED,LOW,Analytics,UNKNOWN,LOW,True,False,False,False,,,,,https://cloudmarketplace.oracle.com/marketplace/en_US/listing/172343814,,Analysis based on content only - no government region access
172821855,172821855,Fortinet FortiGuest Guest Access and Policy Management (BYOL),Fortinet,,Networking,Security,"FortiGuest is a sophisticated network security solution specifically designed to address the challenges of guest access in modern environments. By providing a seamless and secure method for granting temporary network access
to visitors, contractors, and partners, FortiGuest streamlines the process while maintaining the",,PARTNER,IMAGE,,,,,,,,,,,,,,,,,,,,,,,,X86,,,,UNKNOWN,False,False,UNKNOWN,,False,False,UNKNOWN,False,UNRESTRICTED,HIGH,Networking,LOW,LOW,True,True,False,True,,,,,https://cloudmarketplace.oracle.com/marketplace/en_US/listing/172821855,,Analysis based on content only - no government region access
172845696,172845696,Oracle Integration Cloud API Catalog & Portal by digitalML,digitalML,,Packaged Application,Data Integration,"A joint collaboration between Oracle and digitalML. ""It is a new version of digitalML's leading API management Platform now available exclusively for OIC"" Niall Commiskey Oracle.",,PARTNER,ORCHESTRATION,,,,,,,,,,,,,,,,,,,,,,,,,,,,UNKNOWN,False,False,UNKNOWN,,False,False,UNKNOWN,False,UNRESTRICTED,LOW,AI/ML,UNKNOWN,LOW,False,True,True,False,,,,,https://cloudmarketplace.oracle.com/marketplace/en_US/listing/172845696,,Analysis based on content only - no government region access
172909410,172909410,Fortinet FortiAIOps - AI & ML Network Operations (BYOL),Fortinet,,Data & Analytics,Artificial Intelligence,FortiAIOps simplifies LAN and WAN network management and leverages artificial intelligence with machine learning for enhanced network operations.,,PARTNER,IMAGE,,,,,,,,,,,,,,,,,,,,,,,,X86,,,,UNKNOWN,False,False,UNKNOWN,,False,False,UNKNOWN,False,RESTRICTED,HIGH,Analytics,LOW,LOW,False,True,False,True,,,,,https://cloudmarketplace.oracle.com/marketplace/en_US/listing/172909410,,Analysis based on content only - no government region access
173334885,173334885,Rocky Linux (Latest 8/9 Releases) with CIQ Enterprise Assurance (x86_64),"Ctrl IQ, Inc.",,Operating Systems,,"Enterprise-ready Linux distribution offering seamless compatibility with and migration from RHEL® plus enhanced security and enterprise assurance from CIQ, on Oracle Cloud.",,PARTNER,IMAGE,,,,,,,,,,,,,,,,,,,,,,,,X86,,,,UNKNOWN,False,False,UNKNOWN,,False,False,UNKNOWN,False,UNRESTRICTED,LOW,Other,LOW,LOW,True,True,True,False,,,,,https://cloudmarketplace.oracle.com/marketplace/en_US/listing/173334885,,Analysis based on content only - no government region access
173489812,173489812,Hopsworks Realtime GenAI Platform,Hopsworks,,Data & Analytics,Artificial Intelligence,"The Only Realtime GenAI Platform for Best Predictions, Fastest Time to Value, and Any Scale, on OCI or Hybrid.",,PARTNER,IMAGE,,,,,,,,,,,,,,,,,,,,,,,,X86,,,,UNKNOWN,False,False,UNKNOWN,,False,False,UNKNOWN,False,UNRESTRICTED,LOW,Analytics,LOW,LOW,False,True,False,False,,,,,https://cloudmarketplace.oracle.com/marketplace/en_US/listing/173489812,,Analysis based on content only - no government region access
173490882,173490882,Hopsworks AI Driven Streaming Fraud and Money Laundering Prevention Platform,Hopsworks,,Data & Analytics,Artificial Intelligence,"The Only AI Driven Streaming Fraud Money Laundering Prevention Platform for Best Predictions, Fastest Time to Value, and Any Scale, on OCI or Hybrid.",,PARTNER,IMAGE,,,,,,,,,,,,,,,,,,,,,,,,X86,,,,UNKNOWN,False,False,UNKNOWN,,False,False,UNKNOWN,False,UNRESTRICTED,LOW,Analytics,LOW,LOW,False,True,False,False,,,,,https://cloudmarketplace.oracle.com/marketplace/en_US/listing/173490882,,Analysis based on content only - no government region access
173491360,173491360,Hopsworks AI Lakehouse,Hopsworks,,Data & Analytics,Artificial Intelligence,"The Only Open AI Lakehouse for Best Predictions, Fastest Time to Value, and Any Scale, on OCI or Hybrid.",,PARTNER,IMAGE,,,,,,,,,,,,,,,,,,,,,,,,X86,,,,UNKNOWN,False,False,UNKNOWN,,False,False,UNKNOWN,False,UNRESTRICTED,LOW,Analytics,LOW,LOW,False,True,False,False,,,,,https://cloudmarketplace.oracle.com/marketplace/en_US/listing/173491360,,Analysis based on content only - no government region access
173491758,173491758,Hopsworks AI Diven Streaming Recommendations Platform,Hopsworks,,Data & Analytics,Artificial Intelligence,"The Only AI Driven Personalized Recommendations Platform for Best Predictions, Fastest Time to Value, and Any Scale, on OCI or Hybrid.",,PARTNER,IMAGE,,,,,,,,,,,,,,,,,,,,,,,,X86,,,,UNKNOWN,False,False,UNKNOWN,,False,False,UNKNOWN,False,UNRESTRICTED,LOW,Analytics,LOW,LOW,False,True,False,False,,,,,https://cloudmarketplace.oracle.com/marketplace/en_US/listing/173491758,,Analysis based on content only - no government region access
173531281,173531281,Oracle E-Business Suite 12.2.14 Fresh Install Image,Oracle,,Packaged Application,Business Applications,"Oracle E-Business Suite (EBS) is a comprehensive set of integrated global business applications. The machine image provided by this app allows you to create a single-node, fresh installation of EBS Release 12.2.14 and Oracle Database 19c.",,PARTNER,IMAGE,,,,,,,,,,,,,,,,,,,,,,,,X86,,,,UNKNOWN,False,False,UNKNOWN,,False,False,UNKNOWN,False,UNRESTRICTED,LOW,Other,LOW,LOW,False,False,True,False,,,,,https://cloudmarketplace.oracle.com/marketplace/en_US/listing/173531281,,Analysis based on content only - no government region access
173536921,173536921,Oracle E-Business Suite 12.2.14 Demo Install Image,Oracle,,Packaged Application,Business Applications,"Oracle E-Business Suite is a comprehensive set of integrated global business applications. The machine image provided by this app allows you to create a single-node instance containing Oracle E-Business Suite Release 12.2.14 and Oracle Database Release 19c with example data, for demonstration use.",,PARTNER,IMAGE,,,,,,,,,,,,,,,,,,,,,,,,X86,,,,UNKNOWN,False,False,UNKNOWN,,False,False,UNKNOWN,False,UNRESTRICTED,LOW,Other,LOW,LOW,False,True,True,False,,,,,https://cloudmarketplace.oracle.com/marketplace/en_US/listing/173536921,,Analysis based on content only - no government region access
173572265,173572265,Globally Distributed Database - GDS Image,Oracle,,Database,,Globally Distributed Database - GDS Image,,PARTNER,IMAGE,,,,,,,,,,,,,,,,,,,,,,,,X86,,,,UNKNOWN,False,False,UNKNOWN,,False,False,UNKNOWN,False,UNRESTRICTED,LOW,Database,LOW,LOW,False,False,True,False,,,,,https://cloudmarketplace.oracle.com/marketplace/en_US/listing/173572265,,Analysis based on content only - no government region access
174336478,174336478,Mindbreeze InSpire 1M,Mindbreeze Corporation,,Data & Analytics,Artificial Intelligence,Make better business decisions with AI-generated knowledge from Mindbreeze InSpire.,,PARTNER,IMAGE,,,,,,,,,,,,,,,,,,,,,,,,X86,,,,UNKNOWN,False,False,UNKNOWN,,False,False,UNKNOWN,False,UNRESTRICTED,LOW,Analytics,LOW,LOW,False,True,False,False,,,,,https://cloudmarketplace.oracle.com/marketplace/en_US/listing/174336478,,Analysis based on content only - no government region access
174540307,174540307,Oracle Blockchain Platform Enterprise Edition,Oracle,,Blockchain,,"Oracle Blockchain Platform Enterprise Edition for Oracle Cloud Infrastructure Container Engine for Kubernetes supports simplified provisioning of Oracle Blockchain Platform configurations for development, deployment and monitoring of permissioned blockchain on Oracle Cloud Infrastructure running in Kubernetes",,PARTNER,ORCHESTRATION,,,,,,,,,,,,,,,,,,,,,,,,,,,,UNKNOWN,False,False,UNKNOWN,,False,False,UNKNOWN,False,UNRESTRICTED,LOW,AI/ML,UNKNOWN,LOW,False,True,True,False,,,,,https://cloudmarketplace.oracle.com/marketplace/en_US/listing/174540307,,Analysis based on content only - no government region access
174862207,174862207,Security Fundamentals Dashboards,Oracle,,Security,Landing Zone Extension,Oracle Cloud Infrastructure Security Fundamentals Dashboards using OCI Logging Analytics,,PARTNER,ORCHESTRATION,,,,,,,,,,,,,,,,,,,,,,,,,,,,UNKNOWN,False,False,UNKNOWN,,False,False,UNKNOWN,False,UNRESTRICTED,LOW,Security,UNKNOWN,LOW,True,False,True,False,,,,,https://cloudmarketplace.oracle.com/marketplace/en_US/listing/174862207,,Analysis based on content only - no government region access
174862618,174862618,Oracle WebCenter Enterprise Capture Standard Edition 12c UCM Image,Oracle,,Application Development,,"Oracle WebCenter Enterprise Capture is an advanced document capture solution. It automates the ingestion of paper and electronic documents, extracting valuable data for processing and integration into business workflows.",,PARTNER,IMAGE,,,,,,,,,,,,,,,,,,,,,,,,X86,,,,UNKNOWN,False,False,UNKNOWN,,False,False,UNKNOWN,False,UNRESTRICTED,LOW,Other,LOW,LOW,False,False,True,False,,,,,https://cloudmarketplace.oracle.com/marketplace/en_US/listing/174862618,,Analysis based on content only - no government region access
175095126,175095126,Mindbreeze InSpire 10M,Mindbreeze Corporation,,Data & Analytics,Artificial Intelligence,Make better business decisions with AI-generated knowledge from Mindbreeze InSpire.,,PARTNER,IMAGE,,,,,,,,,,,,,,,,,,,,,,,,X86,,,,UNKNOWN,False,False,UNKNOWN,,False,False,UNKNOWN,False,UNRESTRICTED,LOW,Analytics,LOW,LOW,False,True,False,False,,,,,https://cloudmarketplace.oracle.com/marketplace/en_US/listing/175095126,,Analysis based on content only - no government region access
175374675,175374675,Oracle WebCenter Content 12c UCM Image,Oracle,,Application Development,,"Oracle WebCenter Content document management solution allows organizations to effectively and efficiently capture, secure, share, and distribute digital and paper-based documents and reports.",,PARTNER,IMAGE,,,,,,,,,,,,,,,,,,,,,,,,X86,,,,UNKNOWN,False,False,UNKNOWN,,False,False,UNKNOWN,False,UNRESTRICTED,LOW,Other,LOW,LOW,False,False,True,False,,,,,https://cloudmarketplace.oracle.com/marketplace/en_US/listing/175374675,,Analysis based on content only - no government region access
